{
  "$schema": "cdb.raw/1",
  "schema": "cdb.raw/1",
  "integerEncoding": "signed-int64-decimal",
  "source": {
    "fileName": "orphan-test.cdb",
    "sha256": "sha256:e3b0c44298fc1c149afbf4c8996fb92427ae41e4649b934ca495991b7852b855",
    "sizeBytes": 8192,
    "converter": "cdb-to-json/2.0.0"
  },
  "tables": {
    "datas": [],
    "texts": [
      {
        "id": "8888",
        "name": "Orphan Texts Only",
        "desc": "This card has texts but no datas row.",
        "str1": null,
        "str2": null,
        "str3": null,
        "str4": null,
        "str5": null,
        "str6": null,
        "str7": null,
        "str8": null,
        "str9": null,
        "str10": null,
        "str11": null,
        "str12": null,
        "str13": null,
        "str14": null,
        "str15": null,
        "str16": null
      }
    ]
  },
  "extraTables": []
}
